lightllm/common/triton_utils/autotune_kernel_configs/triton_3.5.1/NVIDIA_H200/chunk_local_cumsum_scalar/{B=1,BT=64,H=8,IS_VARLEN=true,REVERSE=false}_NVIDIA_H200.json
{
  "1": {
    "num_warps": 4
  },
  "100": {
    "num_warps": 8
  },
  "1024": {
    "num_warps": 8
  },
  "128": {
    "num_warps": 2
  },
  "131072": {
    "num_warps": 1
  },
  "16": {
    "num_warps": 8
  },
  "16384": {
    "num_warps": 1
  },
  "16640": {
    "num_warps": 1
  },
  "2048": {
    "num_warps": 1
  },
  "256": {
    "num_warps": 1
  },
  "32": {
    "num_warps": 2
  },
  "4096": {
    "num_warps": 1
  },
  "64": {
    "num_warps": 4
  },
  "8": {
    "num_warps": 8
  },
  "8448": {
    "num_warps": 1
  }
}