lightllm/common/triton_utils/autotune_kernel_configs/triton_3.6.0/NVIDIA_H200/append_fused_shared_experts:v1/{has_shared_expert_gate=false,num_fused_shared_experts=1,topk_ids_dtype=torch.int64,topk_num=8,topk_weights_dtype=torch.float32}_NVIDIA_H200.json
{
  "1": {
    "BLOCK_TOKEN": 16,
    "num_warps": 1
  },
  "100": {
    "BLOCK_TOKEN": 8,
    "num_warps": 2
  },
  "1024": {
    "BLOCK_TOKEN": 16,
    "num_warps": 1
  },
  "128": {
    "BLOCK_TOKEN": 16,
    "num_warps": 1
  },
  "16": {
    "BLOCK_TOKEN": 32,
    "num_warps": 8
  },
  "16384": {
    "BLOCK_TOKEN": 64,
    "num_warps": 8
  },
  "2048": {
    "BLOCK_TOKEN": 32,
    "num_warps": 8
  },
  "256": {
    "BLOCK_TOKEN": 32,
    "num_warps": 8
  },
  "32": {
    "BLOCK_TOKEN": 32,
    "num_warps": 8
  },
  "4096": {
    "BLOCK_TOKEN": 32,
    "num_warps": 8
  },
  "64": {
    "BLOCK_TOKEN": 16,
    "num_warps": 1
  },
  "8": {
    "BLOCK_TOKEN": 16,
    "num_warps": 1
  }
}