lightllm/common/all_kernel_configs/_fwd_kernel_gqa_flash_decode_diverse_stage2:v1/{block_seq=256,gqa_group_size=4,out_dtype=torch.bfloat16,q_head_dim=128}_NVIDIA_GeForce_RTX_5090.json
{"3072": {"1": {"BLOCK_N": 32, "num_warps": 8, "num_stages": 7}, "4": {"BLOCK_N": 32, "num_warps": 4, "num_stages": 3}, "10": {"BLOCK_N": 32, "num_warps": 4, "num_stages": 3}, "16": {"BLOCK_N": 16, "num_warps": 4, "num_stages": 9}, "24": {"BLOCK_N": 32, "num_warps": 4, "num_stages": 3}, "32": {"BLOCK_N": 32, "num_warps": 4, "num_stages": 3}}}