lightllm/common/triton_utils/autotune_kernel_configs/triton_3.5.1/NVIDIA_GeForce_RTX_5090/_fwd_kernel_flash_decode_diverse_stage2:v1/{block_seq=256,gqa_group_size=4,out_dtype=torch.bfloat16,q_head_dim=128}_NVIDIA_GeForce_RTX_5090.json
{
  "16_8192": {
    "BLOCK_N": 32,
    "num_stages": 2,
    "num_warps": 4
  },
  "32_8192": {
    "BLOCK_N": 32,
    "num_stages": 4,
    "num_warps": 4
  },
  "64_8192": {
    "BLOCK_N": 16,
    "num_stages": 3,
    "num_warps": 2
  },
  "8_8192": {
    "BLOCK_N": 16,
    "num_stages": 2,
    "num_warps": 2
  }
}