lightllm/common/triton_utils/autotune_kernel_configs/triton_3.5.1/NVIDIA_GeForce_RTX_5090/_fwd_kernel_flash_decode_diverse_stage2:v1/{block_seq=256,gqa_group_size=4,out_dtype=torch.bfloat16,q_head_dim=128}_NVIDIA_GeForce_RTX_5090.json
{
  "128_4096": {
    "BLOCK_N": 16,
    "num_stages": 5,
    "num_warps": 2
  },
  "128_8192": {
    "BLOCK_N": 16,
    "num_stages": 5,
    "num_warps": 2
  },
  "16_1024": {
    "BLOCK_N": 16,
    "num_stages": 2,
    "num_warps": 2
  },
  "16_2048": {
    "BLOCK_N": 16,
    "num_stages": 2,
    "num_warps": 2
  },
  "16_4096": {
    "BLOCK_N": 16,
    "num_stages": 2,
    "num_warps": 4
  },
  "16_8192": {
    "BLOCK_N": 16,
    "num_stages": 2,
    "num_warps": 4
  },
  "256_4096": {
    "BLOCK_N": 16,
    "num_stages": 5,
    "num_warps": 2
  },
  "256_8192": {
    "BLOCK_N": 16,
    "num_stages": 5,
    "num_warps": 2
  },
  "32_1024": {
    "BLOCK_N": 16,
    "num_stages": 2,
    "num_warps": 2
  },
  "32_2048": {
    "BLOCK_N": 16,
    "num_stages": 2,
    "num_warps": 4
  },
  "32_4096": {
    "BLOCK_N": 16,
    "num_stages": 2,
    "num_warps": 4
  },
  "32_8192": {
    "BLOCK_N": 16,
    "num_stages": 5,
    "num_warps": 2
  },
  "64_1024": {
    "BLOCK_N": 16,
    "num_stages": 2,
    "num_warps": 4
  },
  "64_2048": {
    "BLOCK_N": 16,
    "num_stages": 2,
    "num_warps": 4
  },
  "64_4096": {
    "BLOCK_N": 16,
    "num_stages": 5,
    "num_warps": 2
  },
  "64_8192": {
    "BLOCK_N": 16,
    "num_stages": 5,
    "num_warps": 2
  },
  "8_1024": {
    "BLOCK_N": 16,
    "num_stages": 9,
    "num_warps": 4
  },
  "8_2048": {
    "BLOCK_N": 16,
    "num_stages": 2,
    "num_warps": 2
  },
  "8_4096": {
    "BLOCK_N": 16,
    "num_stages": 2,
    "num_warps": 2
  },
  "8_8192": {
    "BLOCK_N": 16,
    "num_stages": 2,
    "num_warps": 4
  }
}