lightllm/common/triton_utils/autotune_kernel_configs/triton_3.5.1/NVIDIA_H200/silu_and_mul_fwd:v1/{N=128,out_dtype=torch.bfloat16}_NVIDIA_H200.json
{
  "1": {
    "BLOCK_M": 8,
    "BLOCK_N": 32,
    "NUM_STAGES": 2,
    "num_warps": 8
  },
  "10": {
    "BLOCK_M": 1,
    "BLOCK_N": 256,
    "NUM_STAGES": 2,
    "num_warps": 1
  },
  "100": {
    "BLOCK_M": 1,
    "BLOCK_N": 128,
    "NUM_STAGES": 2,
    "num_warps": 8
  },
  "1000": {
    "BLOCK_M": 1,
    "BLOCK_N": 128,
    "NUM_STAGES": 1,
    "num_warps": 1
  },
  "1024": {
    "BLOCK_M": 1,
    "BLOCK_N": 128,
    "NUM_STAGES": 1,
    "num_warps": 1
  },
  "10240": {
    "BLOCK_M": 8,
    "BLOCK_N": 128,
    "NUM_STAGES": 4,
    "num_warps": 1
  },
  "128": {
    "BLOCK_M": 1,
    "BLOCK_N": 256,
    "NUM_STAGES": 1,
    "num_warps": 4
  },
  "1280": {
    "BLOCK_M": 1,
    "BLOCK_N": 128,
    "NUM_STAGES": 2,
    "num_warps": 4
  },
  "131072": {
    "BLOCK_M": 32,
    "BLOCK_N": 128,
    "NUM_STAGES": 4,
    "num_warps": 1
  },
  "16": {
    "BLOCK_M": 1,
    "BLOCK_N": 64,
    "NUM_STAGES": 1,
    "num_warps": 1
  },
  "160": {
    "BLOCK_M": 1,
    "BLOCK_N": 256,
    "NUM_STAGES": 1,
    "num_warps": 1
  },
  "16384": {
    "BLOCK_M": 8,
    "BLOCK_N": 128,
    "NUM_STAGES": 4,
    "num_warps": 1
  },
  "163840": {
    "BLOCK_M": 64,
    "BLOCK_N": 128,
    "NUM_STAGES": 4,
    "num_warps": 1
  },
  "16640": {
    "BLOCK_M": 8,
    "BLOCK_N": 128,
    "NUM_STAGES": 4,
    "num_warps": 1
  },
  "166400": {
    "BLOCK_M": 64,
    "BLOCK_N": 128,
    "NUM_STAGES": 4,
    "num_warps": 1
  },
  "2048": {
    "BLOCK_M": 1,
    "BLOCK_N": 128,
    "NUM_STAGES": 1,
    "num_warps": 1
  },
  "20480": {
    "BLOCK_M": 8,
    "BLOCK_N": 128,
    "NUM_STAGES": 4,
    "num_warps": 1
  },
  "256": {
    "BLOCK_M": 1,
    "BLOCK_N": 128,
    "NUM_STAGES": 2,
    "num_warps": 4
  },
  "2560": {
    "BLOCK_M": 8,
    "BLOCK_N": 128,
    "NUM_STAGES": 4,
    "num_warps": 1
  },
  "32": {
    "BLOCK_M": 1,
    "BLOCK_N": 128,
    "NUM_STAGES": 4,
    "num_warps": 8
  },
  "320": {
    "BLOCK_M": 1,
    "BLOCK_N": 256,
    "NUM_STAGES": 1,
    "num_warps": 1
  },
  "327680": {
    "BLOCK_M": 128,
    "BLOCK_N": 128,
    "NUM_STAGES": 4,
    "num_warps": 1
  },
  "4096": {
    "BLOCK_M": 8,
    "BLOCK_N": 128,
    "NUM_STAGES": 4,
    "num_warps": 1
  },
  "40960": {
    "BLOCK_M": 8,
    "BLOCK_N": 128,
    "NUM_STAGES": 4,
    "num_warps": 1
  },
  "64": {
    "BLOCK_M": 1,
    "BLOCK_N": 32,
    "NUM_STAGES": 1,
    "num_warps": 8
  },
  "640": {
    "BLOCK_M": 1,
    "BLOCK_N": 128,
    "NUM_STAGES": 1,
    "num_warps": 1
  },
  "8": {
    "BLOCK_M": 1,
    "BLOCK_N": 256,
    "NUM_STAGES": 1,
    "num_warps": 4
  },
  "80": {
    "BLOCK_M": 1,
    "BLOCK_N": 256,
    "NUM_STAGES": 2,
    "num_warps": 1
  },
  "8448": {
    "BLOCK_M": 8,
    "BLOCK_N": 128,
    "NUM_STAGES": 4,
    "num_warps": 1
  },
  "84480": {
    "BLOCK_M": 32,
    "BLOCK_N": 128,
    "NUM_STAGES": 4,
    "num_warps": 1
  }
}