lightllm/common/triton_utils/autotune_kernel_configs/triton_3.5.1/NVIDIA_H200/silu_and_mul_fwd:v1/{N=768,out_dtype=torch.bfloat16}_NVIDIA_H200.json
{
  "1": {
    "BLOCK_M": 8,
    "BLOCK_N": 256,
    "NUM_STAGES": 4,
    "num_warps": 8
  },
  "100": {
    "BLOCK_M": 1,
    "BLOCK_N": 128,
    "NUM_STAGES": 1,
    "num_warps": 1
  },
  "1024": {
    "BLOCK_M": 8,
    "BLOCK_N": 256,
    "NUM_STAGES": 4,
    "num_warps": 1
  },
  "11776": {
    "BLOCK_M": 1,
    "BLOCK_N": 256,
    "NUM_STAGES": 4,
    "num_warps": 1
  },
  "128": {
    "BLOCK_M": 1,
    "BLOCK_N": 256,
    "NUM_STAGES": 2,
    "num_warps": 1
  },
  "12800": {
    "BLOCK_M": 1,
    "BLOCK_N": 256,
    "NUM_STAGES": 4,
    "num_warps": 1
  },
  "135040": {
    "BLOCK_M": 8,
    "BLOCK_N": 128,
    "NUM_STAGES": 4,
    "num_warps": 1
  },
  "135168": {
    "BLOCK_M": 1,
    "BLOCK_N": 128,
    "NUM_STAGES": 4,
    "num_warps": 1
  },
  "16": {
    "BLOCK_M": 1,
    "BLOCK_N": 128,
    "NUM_STAGES": 2,
    "num_warps": 4
  },
  "16384": {
    "BLOCK_M": 32,
    "BLOCK_N": 128,
    "NUM_STAGES": 4,
    "num_warps": 1
  },
  "16640": {
    "BLOCK_M": 32,
    "BLOCK_N": 128,
    "NUM_STAGES": 4,
    "num_warps": 1
  },
  "19584": {
    "BLOCK_M": 32,
    "BLOCK_N": 256,
    "NUM_STAGES": 4,
    "num_warps": 1
  },
  "2048": {
    "BLOCK_M": 8,
    "BLOCK_N": 128,
    "NUM_STAGES": 4,
    "num_warps": 1
  },
  "20992": {
    "BLOCK_M": 32,
    "BLOCK_N": 256,
    "NUM_STAGES": 4,
    "num_warps": 1
  },
  "256": {
    "BLOCK_M": 1,
    "BLOCK_N": 256,
    "NUM_STAGES": 1,
    "num_warps": 1
  },
  "32": {
    "BLOCK_M": 1,
    "BLOCK_N": 64,
    "NUM_STAGES": 1,
    "num_warps": 1
  },
  "3200": {
    "BLOCK_M": 8,
    "BLOCK_N": 128,
    "NUM_STAGES": 1,
    "num_warps": 1
  },
  "3584": {
    "BLOCK_M": 8,
    "BLOCK_N": 256,
    "NUM_STAGES": 4,
    "num_warps": 1
  },
  "36224": {
    "BLOCK_M": 8,
    "BLOCK_N": 128,
    "NUM_STAGES": 4,
    "num_warps": 1
  },
  "36608": {
    "BLOCK_M": 8,
    "BLOCK_N": 128,
    "NUM_STAGES": 4,
    "num_warps": 1
  },
  "384": {
    "BLOCK_M": 1,
    "BLOCK_N": 256,
    "NUM_STAGES": 2,
    "num_warps": 1
  },
  "4": {
    "BLOCK_M": 1,
    "BLOCK_N": 128,
    "NUM_STAGES": 1,
    "num_warps": 1
  },
  "400": {
    "BLOCK_M": 1,
    "BLOCK_N": 256,
    "NUM_STAGES": 1,
    "num_warps": 1
  },
  "4096": {
    "BLOCK_M": 8,
    "BLOCK_N": 256,
    "NUM_STAGES": 4,
    "num_warps": 1
  },
  "512": {
    "BLOCK_M": 1,
    "BLOCK_N": 256,
    "NUM_STAGES": 1,
    "num_warps": 1
  },
  "5248": {
    "BLOCK_M": 8,
    "BLOCK_N": 256,
    "NUM_STAGES": 4,
    "num_warps": 1
  },
  "5504": {
    "BLOCK_M": 8,
    "BLOCK_N": 256,
    "NUM_STAGES": 4,
    "num_warps": 1
  },
  "64": {
    "BLOCK_M": 1,
    "BLOCK_N": 256,
    "NUM_STAGES": 1,
    "num_warps": 1
  },
  "640": {
    "BLOCK_M": 1,
    "BLOCK_N": 256,
    "NUM_STAGES": 1,
    "num_warps": 4
  },
  "65536": {
    "BLOCK_M": 8,
    "BLOCK_N": 128,
    "NUM_STAGES": 4,
    "num_warps": 1
  },
  "66560": {
    "BLOCK_M": 1,
    "BLOCK_N": 128,
    "NUM_STAGES": 4,
    "num_warps": 1
  },
  "6912": {
    "BLOCK_M": 8,
    "BLOCK_N": 256,
    "NUM_STAGES": 1,
    "num_warps": 1
  },
  "7808": {
    "BLOCK_M": 8,
    "BLOCK_N": 256,
    "NUM_STAGES": 4,
    "num_warps": 1
  },
  "8": {
    "BLOCK_M": 1,
    "BLOCK_N": 128,
    "NUM_STAGES": 2,
    "num_warps": 4
  },
  "8192": {
    "BLOCK_M": 8,
    "BLOCK_N": 256,
    "NUM_STAGES": 4,
    "num_warps": 1
  }
}