lightllm/common/all_kernel_configs/_fwd_kernel_flash_decode_diverse_stage2:v1/{block_seq=256,gqa_group_size=4,out_dtype=torch.bfloat16,q_head_dim=128}_NVIDIA_GeForce_RTX_4090_D.json
{"32": {"8": {"BLOCK_N": 32, "num_warps": 16, "num_stages": 3}, "16": {"BLOCK_N": 16, "num_warps": 8, "num_stages": 5}, "32": {"BLOCK_N": 16, "num_warps": 2, "num_stages": 2}, "64": {"BLOCK_N": 16, "num_warps": 2, "num_stages": 2}}, "64": {"8": {"BLOCK_N": 16, "num_warps": 2, "num_stages": 2}, "16": {"BLOCK_N": 64, "num_warps": 8, "num_stages": 2}, "32": {"BLOCK_N": 16, "num_warps": 2, "num_stages": 3}, "64": {"BLOCK_N": 16, "num_warps": 2, "num_stages": 2}}, "128": {"8": {"BLOCK_N": 32, "num_warps": 16, "num_stages": 2}, "16": {"BLOCK_N": 16, "num_warps": 2, "num_stages": 2}, "32": {"BLOCK_N": 64, "num_warps": 4, "num_stages": 4}, "64": {"BLOCK_N": 16, "num_warps": 2, "num_stages": 4}}, "256": {"8": {"BLOCK_N": 64, "num_warps": 4, "num_stages": 1}, "16": {"BLOCK_N": 32, "num_warps": 4, "num_stages": 9}, "32": {"BLOCK_N": 32, "num_warps": 4, "num_stages": 2}, "64": {"BLOCK_N": 16, "num_warps": 2, "num_stages": 2}}}