lightllm/common/triton_utils/autotune_kernel_configs/triton_3.5.1/NVIDIA_H200/glm_context_attention_fwd_with_v:v1/{dtype=torch.bfloat16,num_heads=20,q_nope_dim=192,q_rope_dim=64,v_dim=256}_NVIDIA_H200.json
{
  "1": {
    "BLOCK": 32,
    "num_stages": 2,
    "num_warps": 4
  },
  "100": {
    "BLOCK": 64,
    "num_stages": 2,
    "num_warps": 8
  },
  "1024": {
    "BLOCK": 64,
    "num_stages": 2,
    "num_warps": 4
  },
  "128": {
    "BLOCK": 64,
    "num_stages": 2,
    "num_warps": 8
  },
  "16": {
    "BLOCK": 32,
    "num_stages": 2,
    "num_warps": 8
  },
  "16384": {
    "BLOCK": 64,
    "num_stages": 1,
    "num_warps": 4
  },
  "2048": {
    "BLOCK": 64,
    "num_stages": 1,
    "num_warps": 4
  },
  "256": {
    "BLOCK": 64,
    "num_stages": 2,
    "num_warps": 8
  },
  "32": {
    "BLOCK": 32,
    "num_stages": 2,
    "num_warps": 4
  },
  "4096": {
    "BLOCK": 64,
    "num_stages": 1,
    "num_warps": 4
  },
  "64": {
    "BLOCK": 64,
    "num_stages": 2,
    "num_warps": 8
  },
  "8": {
    "BLOCK": 32,
    "num_stages": 2,
    "num_warps": 8
  }
}