lightllm/common/triton_utils/autotune_kernel_configs/triton_3.5.0/NVIDIA_H200/_fwd_kernel_mtp_diverse_stage2_single_token:v2/{block_n=16,out_dtype=torch.float16,q_head_dim=128}_NVIDIA_H200.json
{
  "1000000128": {
    "num_stages": 1,
    "num_warps": 4
  },
  "128000000032": {
    "num_stages": 1,
    "num_warps": 4
  },
  "16000000128": {
    "num_stages": 1,
    "num_warps": 2
  },
  "32000000064": {
    "num_stages": 1,
    "num_warps": 2
  },
  "64000000064": {
    "num_stages": 1,
    "num_warps": 2
  },
  "8000000128": {
    "num_stages": 1,
    "num_warps": 4
  }
}