lightllm/common/triton_utils/autotune_kernel_configs/triton_3.6.0/NVIDIA_GeForce_RTX_5090/moe_sum_reduce:v1/{hidden_dim=2048,out_dtype=torch.bfloat16,topk_num=8}_NVIDIA_GeForce_RTX_5090.json
{
  "1": {
    "BLOCK_DIM": 256,
    "BLOCK_M": 1,
    "NUM_STAGE": 2,
    "num_warps": 8
  },
  "100": {
    "BLOCK_DIM": 512,
    "BLOCK_M": 1,
    "NUM_STAGE": 1,
    "num_warps": 4
  },
  "1024": {
    "BLOCK_DIM": 256,
    "BLOCK_M": 1,
    "NUM_STAGE": 1,
    "num_warps": 1
  },
  "128": {
    "BLOCK_DIM": 256,
    "BLOCK_M": 1,
    "NUM_STAGE": 1,
    "num_warps": 1
  },
  "1536": {
    "BLOCK_DIM": 1024,
    "BLOCK_M": 1,
    "NUM_STAGE": 1,
    "num_warps": 8
  },
  "16": {
    "BLOCK_DIM": 64,
    "BLOCK_M": 2,
    "NUM_STAGE": 4,
    "num_warps": 4
  },
  "2": {
    "BLOCK_DIM": 256,
    "BLOCK_M": 4,
    "NUM_STAGE": 4,
    "num_warps": 2
  },
  "2048": {
    "BLOCK_DIM": 256,
    "BLOCK_M": 1,
    "NUM_STAGE": 1,
    "num_warps": 1
  },
  "24": {
    "BLOCK_DIM": 128,
    "BLOCK_M": 1,
    "NUM_STAGE": 4,
    "num_warps": 8
  },
  "256": {
    "BLOCK_DIM": 256,
    "BLOCK_M": 1,
    "NUM_STAGE": 1,
    "num_warps": 1
  },
  "3072": {
    "BLOCK_DIM": 256,
    "BLOCK_M": 8,
    "NUM_STAGE": 4,
    "num_warps": 1
  },
  "32": {
    "BLOCK_DIM": 256,
    "BLOCK_M": 1,
    "NUM_STAGE": 2,
    "num_warps": 16
  },
  "4": {
    "BLOCK_DIM": 128,
    "BLOCK_M": 1,
    "NUM_STAGE": 2,
    "num_warps": 4
  },
  "4096": {
    "BLOCK_DIM": 1024,
    "BLOCK_M": 1,
    "NUM_STAGE": 1,
    "num_warps": 8
  },
  "48": {
    "BLOCK_DIM": 512,
    "BLOCK_M": 1,
    "NUM_STAGE": 2,
    "num_warps": 16
  },
  "512": {
    "BLOCK_DIM": 256,
    "BLOCK_M": 2,
    "NUM_STAGE": 1,
    "num_warps": 2
  },
  "64": {
    "BLOCK_DIM": 512,
    "BLOCK_M": 2,
    "NUM_STAGE": 2,
    "num_warps": 16
  },
  "8": {
    "BLOCK_DIM": 256,
    "BLOCK_M": 1,
    "NUM_STAGE": 1,
    "num_warps": 1
  },
  "96": {
    "BLOCK_DIM": 256,
    "BLOCK_M": 1,
    "NUM_STAGE": 1,
    "num_warps": 1
  }
}