lightllm/common/triton_utils/autotune_kernel_configs/triton_3.4.0/NVIDIA_H200/gated_rmsnorm_forward:v1/{N=128,has_bias=false,weight_dtype=torch.bfloat16,x_dtype=torch.bfloat16}_NVIDIA_H200.json
{
  "1024": {
    "BLOCK_N": 256,
    "num_warps": 2
  },
  "128": {
    "BLOCK_N": 256,
    "num_warps": 1
  },
  "2048": {
    "BLOCK_N": 64,
    "num_warps": 1
  },
  "256": {
    "BLOCK_N": 256,
    "num_warps": 1
  },
  "512": {
    "BLOCK_N": 512,
    "num_warps": 4
  },
  "64": {
    "BLOCK_N": 256,
    "num_warps": 1
  },
  "8": {
    "BLOCK_N": 512,
    "num_warps": 8
  },
  "800": {
    "BLOCK_N": 64,
    "num_warps": 1
  },
  "8192": {
    "BLOCK_N": 128,
    "num_warps": 2
  }
}