lightllm/common/triton/all_kernel_configs/triton_3.3.1/NVIDIA_H200/lightllm.common.fused_moe.moe_sum_reduce.moe_sum_reduce/topk_num=8,hidden_dim=4096,out_dtype=torch.bfloat16.json
{
  "1": {
    "BLOCK_DIM": 256,
    "BLOCK_M": 4,
    "NUM_STAGE": 1,
    "num_warps": 4
  },
  "1024": {
    "BLOCK_DIM": 512,
    "BLOCK_M": 2,
    "NUM_STAGE": 4,
    "num_warps": 2
  },
  "128": {
    "BLOCK_DIM": 512,
    "BLOCK_M": 1,
    "NUM_STAGE": 1,
    "num_warps": 8
  },
  "16": {
    "BLOCK_DIM": 256,
    "BLOCK_M": 1,
    "NUM_STAGE": 1,
    "num_warps": 4
  },
  "16384": {
    "BLOCK_DIM": 1024,
    "BLOCK_M": 1,
    "NUM_STAGE": 4,
    "num_warps": 1
  },
  "2": {
    "BLOCK_DIM": 64,
    "BLOCK_M": 1,
    "NUM_STAGE": 1,
    "num_warps": 1
  },
  "2048": {
    "BLOCK_DIM": 1024,
    "BLOCK_M": 1,
    "NUM_STAGE": 4,
    "num_warps": 2
  },
  "256": {
    "BLOCK_DIM": 1024,
    "BLOCK_M": 1,
    "NUM_STAGE": 4,
    "num_warps": 1
  },
  "32": {
    "BLOCK_DIM": 256,
    "BLOCK_M": 1,
    "NUM_STAGE": 1,
    "num_warps": 4
  },
  "4": {
    "BLOCK_DIM": 64,
    "BLOCK_M": 1,
    "NUM_STAGE": 1,
    "num_warps": 1
  },
  "4096": {
    "BLOCK_DIM": 1024,
    "BLOCK_M": 1,
    "NUM_STAGE": 4,
    "num_warps": 2
  },
  "512": {
    "BLOCK_DIM": 1024,
    "BLOCK_M": 1,
    "NUM_STAGE": 4,
    "num_warps": 1
  },
  "64": {
    "BLOCK_DIM": 128,
    "BLOCK_M": 1,
    "NUM_STAGE": 1,
    "num_warps": 2
  },
  "8": {
    "BLOCK_DIM": 128,
    "BLOCK_M": 1,
    "NUM_STAGE": 1,
    "num_warps": 2
  },
  "8192": {
    "BLOCK_DIM": 1024,
    "BLOCK_M": 1,
    "NUM_STAGE": 4,
    "num_warps": 4
  }
}