lightllm/common/all_kernel_configs/moe_sum_reduce_kernel/{hidden_dim=4096,out_dtype=torch.bfloat16,topk_num=1}_NVIDIA_H800.json
{"1": {"BLOCK_M": 1, "BLOCK_DIM": 64, "num_warps": 1, "NUM_STAGE": 4}, "8": {"BLOCK_M": 1, "BLOCK_DIM": 1024, "num_warps": 8, "NUM_STAGE": 2}, "64": {"BLOCK_M": 1, "BLOCK_DIM": 1024, "num_warps": 2, "NUM_STAGE": 3}, "128": {"BLOCK_M": 1, "BLOCK_DIM": 1024, "num_warps": 1, "NUM_STAGE": 5}, "256": {"BLOCK_M": 1, "BLOCK_DIM": 1024, "num_warps": 1, "NUM_STAGE": 5}, "512": {"BLOCK_M": 1, "BLOCK_DIM": 1024, "num_warps": 1, "NUM_STAGE": 3}, "1024": {"BLOCK_M": 1, "BLOCK_DIM": 1024, "num_warps": 1, "NUM_STAGE": 3}, "2048": {"BLOCK_M": 2, "BLOCK_DIM": 1024, "num_warps": 1, "NUM_STAGE": 1}, "4096": {"BLOCK_M": 1, "BLOCK_DIM": 1024, "num_warps": 1, "NUM_STAGE": 3}, "8192": {"BLOCK_M": 1, "BLOCK_DIM": 512, "num_warps": 1, "NUM_STAGE": 4}}