lightllm/common/all_kernel_configs/moe_sum_reduce_kernel/{hidden_dim=4096,out_dtype=torch.bfloat16,topk_num=6}_NVIDIA_A800-SXM4-80GB.json
{"1": {"BLOCK_M": 2, "BLOCK_DIM": 256, "num_warps": 4, "NUM_STAGE": 1}, "8": {"BLOCK_M": 1, "BLOCK_DIM": 512, "num_warps": 8, "NUM_STAGE": 1}, "64": {"BLOCK_M": 1, "BLOCK_DIM": 256, "num_warps": 1, "NUM_STAGE": 1}, "128": {"BLOCK_M": 1, "BLOCK_DIM": 256, "num_warps": 1, "NUM_STAGE": 1}, "256": {"BLOCK_M": 1, "BLOCK_DIM": 512, "num_warps": 2, "NUM_STAGE": 1}, "512": {"BLOCK_M": 1, "BLOCK_DIM": 128, "num_warps": 1, "NUM_STAGE": 1}, "1024": {"BLOCK_M": 1, "BLOCK_DIM": 1024, "num_warps": 1, "NUM_STAGE": 1}, "2048": {"BLOCK_M": 1, "BLOCK_DIM": 1024, "num_warps": 1, "NUM_STAGE": 1}, "4096": {"BLOCK_M": 1, "BLOCK_DIM": 1024, "num_warps": 1, "NUM_STAGE": 1}, "8192": {"BLOCK_M": 1, "BLOCK_DIM": 1024, "num_warps": 1, "NUM_STAGE": 4}}