lightllm/common/all_kernel_configs/moe_sum_reduce_kernel/{hidden_dim=1024,out_dtype=torch.bfloat16,topk_num=6}_NVIDIA_H800.json
{"1": {"BLOCK_M": 1, "BLOCK_DIM": 64, "num_warps": 8, "NUM_STAGE": 2}, "8": {"BLOCK_M": 1, "BLOCK_DIM": 64, "num_warps": 8, "NUM_STAGE": 3}, "64": {"BLOCK_M": 1, "BLOCK_DIM": 512, "num_warps": 8, "NUM_STAGE": 1}, "128": {"BLOCK_M": 1, "BLOCK_DIM": 512, "num_warps": 8, "NUM_STAGE": 1}, "256": {"BLOCK_M": 1, "BLOCK_DIM": 256, "num_warps": 1, "NUM_STAGE": 4}, "512": {"BLOCK_M": 1, "BLOCK_DIM": 256, "num_warps": 1, "NUM_STAGE": 4}, "1024": {"BLOCK_M": 1, "BLOCK_DIM": 512, "num_warps": 2, "NUM_STAGE": 4}, "2048": {"BLOCK_M": 1, "BLOCK_DIM": 1024, "num_warps": 4, "NUM_STAGE": 1}, "4096": {"BLOCK_M": 1, "BLOCK_DIM": 256, "num_warps": 1, "NUM_STAGE": 4}, "8192": {"BLOCK_M": 1, "BLOCK_DIM": 1024, "num_warps": 8, "NUM_STAGE": 1}}