lightllm/common/triton_utils/autotune_kernel_configs/triton_3.5.0/NVIDIA_H100_80GB_HBM3/moe_align_fused:v1/{topk_num=8}_NVIDIA_H100_80GB_HBM3.json
{
  "1": {
    "BLOCK_SIZE": 256,
    "num_warps": 2
  },
  "100": {
    "BLOCK_SIZE": 128,
    "num_warps": 8
  },
  "1024": {
    "BLOCK_SIZE": 128,
    "num_warps": 2
  },
  "128": {
    "BLOCK_SIZE": 128,
    "num_warps": 8
  },
  "16": {
    "BLOCK_SIZE": 256,
    "num_warps": 4
  },
  "2048": {
    "BLOCK_SIZE": 256,
    "num_warps": 8
  },
  "256": {
    "BLOCK_SIZE": 128,
    "num_warps": 8
  },
  "32": {
    "BLOCK_SIZE": 128,
    "num_warps": 8
  },
  "4096": {
    "BLOCK_SIZE": 128,
    "num_warps": 1
  },
  "64": {
    "BLOCK_SIZE": 128,
    "num_warps": 8
  },
  "8": {
    "BLOCK_SIZE": 256,
    "num_warps": 2
  },
  "8448": {
    "BLOCK_SIZE": 256,
    "num_warps": 4
  }
}