lightllm/common/triton_utils/all_kernel_configs/triton_3.3.1/NVIDIA_H200/moe_sum_reduce:v1/topk_num=8,hidden_dim=7168,out_dtype=torch.bfloat16.json
{
  "1": {
    "BLOCK_DIM": 512,
    "BLOCK_M": 16,
    "NUM_STAGE": 1,
    "num_warps": 8
  },
  "1024": {
    "BLOCK_DIM": 256,
    "BLOCK_M": 8,
    "NUM_STAGE": 1,
    "num_warps": 1
  },
  "128": {
    "BLOCK_DIM": 1024,
    "BLOCK_M": 1,
    "NUM_STAGE": 4,
    "num_warps": 2
  },
  "16": {
    "BLOCK_DIM": 512,
    "BLOCK_M": 1,
    "NUM_STAGE": 1,
    "num_warps": 8
  },
  "16384": {
    "BLOCK_DIM": 1024,
    "BLOCK_M": 1,
    "NUM_STAGE": 4,
    "num_warps": 4
  },
  "2": {
    "BLOCK_DIM": 256,
    "BLOCK_M": 1,
    "NUM_STAGE": 4,
    "num_warps": 8
  },
  "2048": {
    "BLOCK_DIM": 256,
    "BLOCK_M": 1,
    "NUM_STAGE": 1,
    "num_warps": 1
  },
  "256": {
    "BLOCK_DIM": 1024,
    "BLOCK_M": 1,
    "NUM_STAGE": 4,
    "num_warps": 2
  },
  "32": {
    "BLOCK_DIM": 512,
    "BLOCK_M": 1,
    "NUM_STAGE": 1,
    "num_warps": 8
  },
  "4": {
    "BLOCK_DIM": 128,
    "BLOCK_M": 1,
    "NUM_STAGE": 2,
    "num_warps": 4
  },
  "4096": {
    "BLOCK_DIM": 256,
    "BLOCK_M": 1,
    "NUM_STAGE": 1,
    "num_warps": 1
  },
  "512": {
    "BLOCK_DIM": 256,
    "BLOCK_M": 4,
    "NUM_STAGE": 1,
    "num_warps": 1
  },
  "64": {
    "BLOCK_DIM": 512,
    "BLOCK_M": 1,
    "NUM_STAGE": 1,
    "num_warps": 8
  },
  "8": {
    "BLOCK_DIM": 512,
    "BLOCK_M": 1,
    "NUM_STAGE": 1,
    "num_warps": 8
  },
  "8192": {
    "BLOCK_DIM": 1024,
    "BLOCK_M": 1,
    "NUM_STAGE": 4,
    "num_warps": 4
  }
}