lightllm/common/triton_utils/autotune_kernel_configs/triton_3.5.1/NVIDIA_H200/fused_gdn_gating:v1/{NUM_HEADS=8,a_dtype=torch.bfloat16}_NVIDIA_H200.json
{
  "1": {
    "BLK_HEADS": 16,
    "num_warps": 2
  },
  "100": {
    "BLK_HEADS": 4,
    "num_warps": 4
  },
  "1024": {
    "BLK_HEADS": 64,
    "num_warps": 4
  },
  "128": {
    "BLK_HEADS": 16,
    "num_warps": 1
  },
  "131072": {
    "BLK_HEADS": 32,
    "num_warps": 4
  },
  "16": {
    "BLK_HEADS": 16,
    "num_warps": 2
  },
  "16384": {
    "BLK_HEADS": 32,
    "num_warps": 4
  },
  "16640": {
    "BLK_HEADS": 64,
    "num_warps": 4
  },
  "2048": {
    "BLK_HEADS": 16,
    "num_warps": 2
  },
  "256": {
    "BLK_HEADS": 16,
    "num_warps": 4
  },
  "32": {
    "BLK_HEADS": 64,
    "num_warps": 1
  },
  "4096": {
    "BLK_HEADS": 16,
    "num_warps": 1
  },
  "64": {
    "BLK_HEADS": 16,
    "num_warps": 1
  },
  "8": {
    "BLK_HEADS": 64,
    "num_warps": 4
  },
  "8448": {
    "BLK_HEADS": 16,
    "num_warps": 2
  }
}