lightllm/common/all_kernel_configs/fp8_block_mm/{K=2048,N=7168,block_size=[128,128],out_dtype=torch.bfloat16}_NVIDIA_H800.json
{"1": {"BLOCK_M": 32, "BLOCK_N": 64, "BLOCK_K": 32, "GROUP_M": 8, "num_stages": 5, "num_warps": 2}, "2": {"BLOCK_M": 32, "BLOCK_N": 64, "BLOCK_K": 32, "GROUP_M": 8, "num_stages": 5, "num_warps": 2}, "4": {"BLOCK_M": 32, "BLOCK_N": 64, "BLOCK_K": 32, "GROUP_M": 8, "num_stages": 5, "num_warps": 2}, "8": {"BLOCK_M": 128, "BLOCK_N": 32, "BLOCK_K": 64, "GROUP_M": 8, "num_stages": 4, "num_warps": 4}, "16": {"BLOCK_M": 128, "BLOCK_N": 32, "BLOCK_K": 64, "GROUP_M": 8, "num_stages": 4, "num_warps": 4}, "24": {"BLOCK_M": 128, "BLOCK_N": 32, "BLOCK_K": 64, "GROUP_M": 8, "num_stages": 4, "num_warps": 4}, "32": {"BLOCK_M": 128, "BLOCK_N": 32, "BLOCK_K": 64, "GROUP_M": 8, "num_stages": 4, "num_warps": 4}, "48": {"BLOCK_M": 128, "BLOCK_N": 32, "BLOCK_K": 64, "GROUP_M": 8, "num_stages": 4, "num_warps": 4}, "64": {"BLOCK_M": 128, "BLOCK_N": 32, "BLOCK_K": 64, "GROUP_M": 8, "num_stages": 4, "num_warps": 4}, "96": {"BLOCK_M": 128, "BLOCK_N": 32, "BLOCK_K": 64, "GROUP_M": 8, "num_stages": 4, "num_warps": 4}, "128": {"BLOCK_M": 128, "BLOCK_N": 32, "BLOCK_K": 64, "GROUP_M": 8, "num_stages": 4, "num_warps": 4}, "256": {"BLOCK_M": 128, "BLOCK_N": 32, "BLOCK_K": 64, "GROUP_M": 8, "num_stages": 4, "num_warps": 4}, "512": {"BLOCK_M": 128, "BLOCK_N": 32, "BLOCK_K": 64, "GROUP_M": 8, "num_stages": 4, "num_warps": 4}, "1024": {"BLOCK_M": 128, "BLOCK_N": 32, "BLOCK_K": 64, "GROUP_M": 8, "num_stages": 4, "num_warps": 4}, "1536": {"BLOCK_M": 128, "BLOCK_N": 32, "BLOCK_K": 64, "GROUP_M": 8, "num_stages": 4, "num_warps": 4}, "2048": {"BLOCK_M": 128, "BLOCK_N": 32, "BLOCK_K": 64, "GROUP_M": 8, "num_stages": 4, "num_warps": 4}, "3072": {"BLOCK_M": 128, "BLOCK_N": 32, "BLOCK_K": 64, "GROUP_M": 8, "num_stages": 4, "num_warps": 4}, "4096": {"BLOCK_M": 128, "BLOCK_N": 32, "BLOCK_K": 64, "GROUP_M": 8, "num_stages": 4, "num_warps": 4}}