lightllm/common/all_kernel_configs/fp8_block_mm/{K=7168,N=8072,block_size=[128,128],out_dtype=torch.bfloat16}_NVIDIA_H200.json
{"8": {"BLOCK_M": 128, "BLOCK_N": 32, "BLOCK_K": 64, "GROUP_M": 8, "num_stages": 4, "num_warps": 4}, "16": {"BLOCK_M": 128, "BLOCK_N": 32, "BLOCK_K": 64, "GROUP_M": 8, "num_stages": 4, "num_warps": 4}, "32": {"BLOCK_M": 128, "BLOCK_N": 32, "BLOCK_K": 64, "GROUP_M": 8, "num_stages": 4, "num_warps": 4}, "100": {"BLOCK_M": 128, "BLOCK_N": 32, "BLOCK_K": 64, "GROUP_M": 8, "num_stages": 4, "num_warps": 4}, "128": {"BLOCK_M": 128, "BLOCK_N": 32, "BLOCK_K": 64, "GROUP_M": 8, "num_stages": 4, "num_warps": 4}, "1024": {"BLOCK_M": 128, "BLOCK_N": 64, "BLOCK_K": 64, "GROUP_M": 8, "num_stages": 4, "num_warps": 4}, "2048": {"BLOCK_M": 128, "BLOCK_N": 32, "BLOCK_K": 64, "GROUP_M": 8, "num_stages": 4, "num_warps": 4}}