lightllm/common/all_kernel_configs/fp8_block_mm/{K=7168,N=2304,block_size=[128,128],out_dtype=torch.bfloat16}_NVIDIA_H800.json
{"1": {"BLOCK_M": 64, "BLOCK_N": 32, "BLOCK_K": 128, "GROUP_M": 64, "num_warps": 4, "num_stages": 1}, "2": {"BLOCK_M": 64, "BLOCK_N": 32, "BLOCK_K": 128, "GROUP_M": 128, "num_warps": 4, "num_stages": 3}, "4": {"BLOCK_M": 64, "BLOCK_N": 32, "BLOCK_K": 128, "GROUP_M": 64, "num_warps": 4, "num_stages": 3}, "8": {"BLOCK_M": 64, "BLOCK_N": 32, "BLOCK_K": 128, "GROUP_M": 32, "num_warps": 4, "num_stages": 3}, "16": {"BLOCK_M": 64, "BLOCK_N": 32, "BLOCK_K": 128, "GROUP_M": 64, "num_warps": 4, "num_stages": 3}, "24": {"BLOCK_M": 64, "BLOCK_N": 32, "BLOCK_K": 128, "GROUP_M": 32, "num_warps": 4, "num_stages": 3}, "32": {"BLOCK_M": 64, "BLOCK_N": 32, "BLOCK_K": 128, "GROUP_M": 32, "num_warps": 4, "num_stages": 3}, "48": {"BLOCK_M": 64, "BLOCK_N": 32, "BLOCK_K": 128, "GROUP_M": 32, "num_warps": 4, "num_stages": 3}, "64": {"BLOCK_M": 64, "BLOCK_N": 32, "BLOCK_K": 128, "GROUP_M": 32, "num_warps": 4, "num_stages": 3}, "96": {"BLOCK_M": 64, "BLOCK_N": 32, "BLOCK_K": 128, "GROUP_M": 64, "num_warps": 4, "num_stages": 3}, "128": {"BLOCK_M": 64, "BLOCK_N": 32, "BLOCK_K": 128, "GROUP_M": 64, "num_warps": 4, "num_stages": 3}, "256": {"BLOCK_M": 64, "BLOCK_N": 32, "BLOCK_K": 128, "GROUP_M": 64, "num_warps": 4, "num_stages": 3}, "512": {"BLOCK_M": 128, "BLOCK_N": 32, "BLOCK_K": 128, "GROUP_M": 128, "num_warps": 4, "num_stages": 2}, "1024": {"BLOCK_M": 128, "BLOCK_N": 32, "BLOCK_K": 128, "GROUP_M": 32, "num_warps": 4, "num_stages": 2}, "1536": {"BLOCK_M": 128, "BLOCK_N": 32, "BLOCK_K": 128, "GROUP_M": 128, "num_warps": 4, "num_stages": 3}, "2048": {"BLOCK_M": 128, "BLOCK_N": 32, "BLOCK_K": 128, "GROUP_M": 64, "num_warps": 4, "num_stages": 2}, "3072": {"BLOCK_M": 128, "BLOCK_N": 32, "BLOCK_K": 128, "GROUP_M": 32, "num_warps": 4, "num_stages": 3}, "4096": {"BLOCK_M": 128, "BLOCK_N": 32, "BLOCK_K": 128, "GROUP_M": 128, "num_warps": 4, "num_stages": 2}}