lightllm/common/all_kernel_configs/bmm_scaled_fp8/{B=16,K=128,M=2,N=512,out_dtype=torch.bfloat16}_NVIDIA_H800.json
{"1": {"128": {"BLOCK_SIZE_M": 64, "BLOCK_SIZE_N": 64, "BLOCK_SIZE_K": 128, "GROUP_SIZE_M": 8, "num_stages": 4, "num_warps": 4}, "512": {"BLOCK_SIZE_M": 64, "BLOCK_SIZE_N": 64, "BLOCK_SIZE_K": 128, "GROUP_SIZE_M": 16, "num_stages": 4, "num_warps": 4}}, "2": {"128": {"BLOCK_SIZE_M": 64, "BLOCK_SIZE_N": 64, "BLOCK_SIZE_K": 128, "GROUP_SIZE_M": 8, "num_stages": 4, "num_warps": 4}, "512": {"BLOCK_SIZE_M": 64, "BLOCK_SIZE_N": 128, "BLOCK_SIZE_K": 64, "GROUP_SIZE_M": 8, "num_stages": 3, "num_warps": 8}}}