lightllm/common/triton_utils/autotune_kernel_configs/triton_3.6.0/NVIDIA_H200/silu_and_mul_fwd:v1/{N=256,out_dtype=torch.bfloat16}_NVIDIA_H200.json
{
  "1": {
    "BLOCK_M": 128,
    "BLOCK_N": 32,
    "NUM_STAGES": 2,
    "num_warps": 4
  },
  "100": {
    "BLOCK_M": 1,
    "BLOCK_N": 128,
    "NUM_STAGES": 4,
    "num_warps": 4
  },
  "1024": {
    "BLOCK_M": 1,
    "BLOCK_N": 256,
    "NUM_STAGES": 1,
    "num_warps": 1
  },
  "12288": {
    "BLOCK_M": 8,
    "BLOCK_N": 256,
    "NUM_STAGES": 1,
    "num_warps": 1
  },
  "128": {
    "BLOCK_M": 1,
    "BLOCK_N": 128,
    "NUM_STAGES": 1,
    "num_warps": 1
  },
  "1536": {
    "BLOCK_M": 1,
    "BLOCK_N": 256,
    "NUM_STAGES": 1,
    "num_warps": 4
  },
  "16": {
    "BLOCK_M": 1,
    "BLOCK_N": 32,
    "NUM_STAGES": 2,
    "num_warps": 4
  },
  "192": {
    "BLOCK_M": 1,
    "BLOCK_N": 128,
    "NUM_STAGES": 4,
    "num_warps": 8
  },
  "2048": {
    "BLOCK_M": 1,
    "BLOCK_N": 256,
    "NUM_STAGES": 1,
    "num_warps": 4
  },
  "24576": {
    "BLOCK_M": 1,
    "BLOCK_N": 256,
    "NUM_STAGES": 4,
    "num_warps": 1
  },
  "256": {
    "BLOCK_M": 1,
    "BLOCK_N": 256,
    "NUM_STAGES": 1,
    "num_warps": 1
  },
  "32": {
    "BLOCK_M": 1,
    "BLOCK_N": 128,
    "NUM_STAGES": 4,
    "num_warps": 8
  },
  "384": {
    "BLOCK_M": 1,
    "BLOCK_N": 256,
    "NUM_STAGES": 2,
    "num_warps": 1
  },
  "4096": {
    "BLOCK_M": 8,
    "BLOCK_N": 256,
    "NUM_STAGES": 4,
    "num_warps": 4
  },
  "48": {
    "BLOCK_M": 1,
    "BLOCK_N": 32,
    "NUM_STAGES": 2,
    "num_warps": 4
  },
  "49152": {
    "BLOCK_M": 32,
    "BLOCK_N": 256,
    "NUM_STAGES": 4,
    "num_warps": 1
  },
  "6": {
    "BLOCK_M": 1,
    "BLOCK_N": 32,
    "NUM_STAGES": 4,
    "num_warps": 8
  },
  "600": {
    "BLOCK_M": 1,
    "BLOCK_N": 256,
    "NUM_STAGES": 1,
    "num_warps": 4
  },
  "6144": {
    "BLOCK_M": 8,
    "BLOCK_N": 256,
    "NUM_STAGES": 1,
    "num_warps": 4
  },
  "64": {
    "BLOCK_M": 1,
    "BLOCK_N": 128,
    "NUM_STAGES": 4,
    "num_warps": 4
  },
  "768": {
    "BLOCK_M": 1,
    "BLOCK_N": 256,
    "NUM_STAGES": 1,
    "num_warps": 4
  },
  "8": {
    "BLOCK_M": 1,
    "BLOCK_N": 64,
    "NUM_STAGES": 1,
    "num_warps": 1
  },
  "8192": {
    "BLOCK_M": 8,
    "BLOCK_N": 256,
    "NUM_STAGES": 1,
    "num_warps": 4
  },
  "96": {
    "BLOCK_M": 1,
    "BLOCK_N": 128,
    "NUM_STAGES": 4,
    "num_warps": 8
  }
}