lightllm/common/all_kernel_configs/grouped_moe_gemm_kernel/{K=128,N=7168,expert_num=256,mul_routed_weight=true,out_dtype=torch.bfloat16,topk_num=1,use_fp8_w8a8=true}_NVIDIA_H100_80GB_HBM3.json
{"1": {"BLOCK_SIZE_M": 16, "BLOCK_SIZE_N": 128, "BLOCK_SIZE_K": 32, "GROUP_SIZE_M": 4, "num_warps": 2, "num_stages": 3}, "8": {"BLOCK_SIZE_M": 16, "BLOCK_SIZE_N": 128, "BLOCK_SIZE_K": 64, "GROUP_SIZE_M": 4, "num_warps": 4, "num_stages": 2}, "64": {"BLOCK_SIZE_M": 16, "BLOCK_SIZE_N": 128, "BLOCK_SIZE_K": 64, "GROUP_SIZE_M": 4, "num_warps": 4, "num_stages": 4}, "128": {"BLOCK_SIZE_M": 16, "BLOCK_SIZE_N": 128, "BLOCK_SIZE_K": 64, "GROUP_SIZE_M": 4, "num_warps": 4, "num_stages": 4}, "256": {"BLOCK_SIZE_M": 16, "BLOCK_SIZE_N": 128, "BLOCK_SIZE_K": 64, "GROUP_SIZE_M": 4, "num_warps": 4, "num_stages": 3}, "512": {"BLOCK_SIZE_M": 16, "BLOCK_SIZE_N": 128, "BLOCK_SIZE_K": 64, "GROUP_SIZE_M": 4, "num_warps": 4, "num_stages": 3}, "1024": {"BLOCK_SIZE_M": 32, "BLOCK_SIZE_N": 128, "BLOCK_SIZE_K": 64, "GROUP_SIZE_M": 4, "num_warps": 4, "num_stages": 3}, "4096": {"BLOCK_SIZE_M": 32, "BLOCK_SIZE_N": 128, "BLOCK_SIZE_K": 64, "GROUP_SIZE_M": 4, "num_warps": 4, "num_stages": 3}, "8192": {"BLOCK_SIZE_M": 32, "BLOCK_SIZE_N": 128, "BLOCK_SIZE_K": 64, "GROUP_SIZE_M": 4, "num_warps": 4, "num_stages": 3}}