lightllm/common/all_kernel_configs/grouped_moe_gemm_kernel/{K=7168,N=1024,expert_num=257,mul_routed_weight=false,out_dtype=torch.bfloat16,topk_num=8,use_fp8_w8a8=true}_NVIDIA_H200.json
{"1": {"BLOCK_SIZE_M": 16, "BLOCK_SIZE_N": 64, "BLOCK_SIZE_K": 128, "GROUP_SIZE_M": 2, "num_warps": 4, "num_stages": 5}, "8": {"BLOCK_SIZE_M": 16, "BLOCK_SIZE_N": 64, "BLOCK_SIZE_K": 128, "GROUP_SIZE_M": 2, "num_warps": 4, "num_stages": 5}, "64": {"BLOCK_SIZE_M": 16, "BLOCK_SIZE_N": 64, "BLOCK_SIZE_K": 128, "GROUP_SIZE_M": 1, "num_warps": 4, "num_stages": 5}, "128": {"BLOCK_SIZE_M": 16, "BLOCK_SIZE_N": 64, "BLOCK_SIZE_K": 128, "GROUP_SIZE_M": 1, "num_warps": 4, "num_stages": 5}, "256": {"BLOCK_SIZE_M": 16, "BLOCK_SIZE_N": 64, "BLOCK_SIZE_K": 128, "GROUP_SIZE_M": 1, "num_warps": 4, "num_stages": 5}}