lightllm/common/all_kernel_configs/grouped_moe_gemm_kernel/{K=7168,N=512,expert_num=257,mul_routed_weight=false,out_dtype=torch.bfloat16,topk_num=8,use_fp8_w8a8=true}_NVIDIA_H200.json
{"1": null, "8": {"BLOCK_SIZE_M": 16, "BLOCK_SIZE_N": 64, "BLOCK_SIZE_K": 128, "GROUP_SIZE_M": 2, "num_warps": 4, "num_stages": 4}, "64": {"BLOCK_SIZE_M": 16, "BLOCK_SIZE_N": 64, "BLOCK_SIZE_K": 128, "GROUP_SIZE_M": 4, "num_warps": 4, "num_stages": 4}, "128": {"BLOCK_SIZE_M": 16, "BLOCK_SIZE_N": 128, "BLOCK_SIZE_K": 128, "GROUP_SIZE_M": 4, "num_warps": 4, "num_stages": 3}, "256": {"BLOCK_SIZE_M": 32, "BLOCK_SIZE_N": 128, "BLOCK_SIZE_K": 128, "GROUP_SIZE_M": 2, "num_warps": 8, "num_stages": 4}, "512": {"BLOCK_SIZE_M": 32, "BLOCK_SIZE_N": 128, "BLOCK_SIZE_K": 128, "GROUP_SIZE_M": 4, "num_warps": 4, "num_stages": 3}, "1024": {"BLOCK_SIZE_M": 32, "BLOCK_SIZE_N": 128, "BLOCK_SIZE_K": 128, "GROUP_SIZE_M": 1, "num_warps": 4, "num_stages": 3}, "4096": null, "8192": null}