lightllm/common/all_kernel_configs/grouped_moe_gemm_kernel/{K=96,N=2048,expert_num=128,mul_routed_weight=true,out_dtype=torch.bfloat16,topk_num=1,use_fp8_w8a8=false}_NVIDIA_H200.json
{"1": {"BLOCK_SIZE_M": 64, "BLOCK_SIZE_N": 128, "BLOCK_SIZE_K": 16, "GROUP_SIZE_M": 1, "num_warps": 4, "num_stages": 5}, "8": {"BLOCK_SIZE_M": 16, "BLOCK_SIZE_N": 128, "BLOCK_SIZE_K": 32, "GROUP_SIZE_M": 1, "num_warps": 2, "num_stages": 1}, "64": {"BLOCK_SIZE_M": 16, "BLOCK_SIZE_N": 128, "BLOCK_SIZE_K": 32, "GROUP_SIZE_M": 1, "num_warps": 2, "num_stages": 1}, "128": {"BLOCK_SIZE_M": 16, "BLOCK_SIZE_N": 128, "BLOCK_SIZE_K": 32, "GROUP_SIZE_M": 1, "num_warps": 2, "num_stages": 1}, "256": {"BLOCK_SIZE_M": 64, "BLOCK_SIZE_N": 128, "BLOCK_SIZE_K": 16, "GROUP_SIZE_M": 1, "num_warps": 4, "num_stages": 4}, "512": {"BLOCK_SIZE_M": 64, "BLOCK_SIZE_N": 128, "BLOCK_SIZE_K": 16, "GROUP_SIZE_M": 1, "num_warps": 4, "num_stages": 4}, "1024": {"BLOCK_SIZE_M": 64, "BLOCK_SIZE_N": 128, "BLOCK_SIZE_K": 16, "GROUP_SIZE_M": 1, "num_warps": 4, "num_stages": 4}, "4096": {"BLOCK_SIZE_M": 128, "BLOCK_SIZE_N": 128, "BLOCK_SIZE_K": 32, "GROUP_SIZE_M": 4, "num_warps": 4, "num_stages": 4}, "8192": {"BLOCK_SIZE_M": 128, "BLOCK_SIZE_N": 128, "BLOCK_SIZE_K": 32, "GROUP_SIZE_M": 4, "num_warps": 8, "num_stages": 4}}