lightllm/common/triton_utils/autotune_kernel_configs/triton_3.5.1/NVIDIA_GeForce_RTX_5090/fp8_scaled_mm_per_token:v1/{K=14336,N=5120,out_dtype=torch.bfloat16}_NVIDIA_GeForce_RTX_5090.json
{
  "1": {
    "BLOCK_K": 128,
    "BLOCK_M": 64,
    "BLOCK_N": 64,
    "GROUP_M": 8,
    "num_stages": 6,
    "num_warps": 8
  },
  "100": {
    "BLOCK_K": 128,
    "BLOCK_M": 64,
    "BLOCK_N": 64,
    "GROUP_M": 8,
    "num_stages": 6,
    "num_warps": 4
  },
  "1024": {
    "BLOCK_K": 128,
    "BLOCK_M": 128,
    "BLOCK_N": 64,
    "GROUP_M": 8,
    "num_stages": 3,
    "num_warps": 4
  },
  "128": {
    "BLOCK_K": 128,
    "BLOCK_M": 64,
    "BLOCK_N": 64,
    "GROUP_M": 8,
    "num_stages": 4,
    "num_warps": 4
  },
  "16": {
    "BLOCK_K": 128,
    "BLOCK_M": 64,
    "BLOCK_N": 64,
    "GROUP_M": 8,
    "num_stages": 6,
    "num_warps": 8
  },
  "256": {
    "BLOCK_K": 128,
    "BLOCK_M": 64,
    "BLOCK_N": 128,
    "GROUP_M": 8,
    "num_stages": 3,
    "num_warps": 4
  },
  "32": {
    "BLOCK_K": 128,
    "BLOCK_M": 64,
    "BLOCK_N": 64,
    "GROUP_M": 8,
    "num_stages": 6,
    "num_warps": 8
  },
  "64": {
    "BLOCK_K": 128,
    "BLOCK_M": 64,
    "BLOCK_N": 64,
    "GROUP_M": 8,
    "num_stages": 3,
    "num_warps": 8
  },
  "8": {
    "BLOCK_K": 128,
    "BLOCK_M": 64,
    "BLOCK_N": 64,
    "GROUP_M": 8,
    "num_stages": 6,
    "num_warps": 4
  }
}