lightllm/common/triton_utils/autotune_kernel_configs/triton_3.6.0/NVIDIA_GeForce_RTX_5090/moe_align_fused:v1/{topk_num=8}_NVIDIA_GeForce_RTX_5090.json
{
  "1": {
    "BLOCK_SIZE": 128,
    "num_warps": 8
  },
  "100": {
    "BLOCK_SIZE": 256,
    "num_warps": 4
  },
  "1024": {
    "BLOCK_SIZE": 128,
    "num_warps": 8
  },
  "128": {
    "BLOCK_SIZE": 128,
    "num_warps": 8
  },
  "1536": {
    "BLOCK_SIZE": 128,
    "num_warps": 8
  },
  "16": {
    "BLOCK_SIZE": 128,
    "num_warps": 8
  },
  "2": {
    "BLOCK_SIZE": 128,
    "num_warps": 2
  },
  "2048": {
    "BLOCK_SIZE": 128,
    "num_warps": 8
  },
  "24": {
    "BLOCK_SIZE": 128,
    "num_warps": 2
  },
  "256": {
    "BLOCK_SIZE": 128,
    "num_warps": 8
  },
  "3072": {
    "BLOCK_SIZE": 128,
    "num_warps": 8
  },
  "32": {
    "BLOCK_SIZE": 512,
    "num_warps": 4
  },
  "4": {
    "BLOCK_SIZE": 256,
    "num_warps": 2
  },
  "4096": {
    "BLOCK_SIZE": 128,
    "num_warps": 8
  },
  "48": {
    "BLOCK_SIZE": 128,
    "num_warps": 8
  },
  "512": {
    "BLOCK_SIZE": 128,
    "num_warps": 8
  },
  "64": {
    "BLOCK_SIZE": 128,
    "num_warps": 8
  },
  "8": {
    "BLOCK_SIZE": 2048,
    "num_warps": 8
  },
  "96": {
    "BLOCK_SIZE": 128,
    "num_warps": 8
  }
}