lightllm/common/triton_utils/autotune_kernel_configs/triton_3.6.0/NVIDIA_GeForce_RTX_5090/grouped_matmul:v1/{K=2048,N=768,block_size_k=0,block_size_n=0,expert_num=128,mul_routed_weight=false,out_dtype=torch.bfloat16,topk_num=8,use_fp8_w8a8=true}_NVIDIA_GeForce_RTX_5090.json
{
  "1": {
    "BLOCK_SIZE_K": 128,
    "BLOCK_SIZE_M": 16,
    "BLOCK_SIZE_N": 64,
    "GROUP_SIZE_M": 16,
    "NEED_TRANS": true,
    "USE_TMA": false,
    "WARP_SPECIALIZE": false,
    "num_stages": 5,
    "num_warps": 4
  },
  "100": {
    "BLOCK_SIZE_K": 128,
    "BLOCK_SIZE_M": 16,
    "BLOCK_SIZE_N": 32,
    "GROUP_SIZE_M": 1,
    "NEED_TRANS": true,
    "num_stages": 4,
    "num_warps": 4
  },
  "1024": {
    "BLOCK_SIZE_K": 128,
    "BLOCK_SIZE_M": 32,
    "BLOCK_SIZE_N": 128,
    "GROUP_SIZE_M": 32,
    "NEED_TRANS": false,
    "USE_TMA": false,
    "WARP_SPECIALIZE": false,
    "num_stages": 3,
    "num_warps": 4
  },
  "128": {
    "BLOCK_SIZE_K": 128,
    "BLOCK_SIZE_M": 16,
    "BLOCK_SIZE_N": 32,
    "GROUP_SIZE_M": 16,
    "NEED_TRANS": true,
    "USE_TMA": false,
    "WARP_SPECIALIZE": false,
    "num_stages": 4,
    "num_warps": 4
  },
  "1536": {
    "BLOCK_SIZE_K": 128,
    "BLOCK_SIZE_M": 64,
    "BLOCK_SIZE_N": 64,
    "GROUP_SIZE_M": 64,
    "NEED_TRANS": false,
    "USE_TMA": false,
    "WARP_SPECIALIZE": false,
    "num_stages": 3,
    "num_warps": 4
  },
  "16": {
    "BLOCK_SIZE_K": 128,
    "BLOCK_SIZE_M": 16,
    "BLOCK_SIZE_N": 32,
    "GROUP_SIZE_M": 64,
    "NEED_TRANS": false,
    "USE_TMA": false,
    "WARP_SPECIALIZE": false,
    "num_stages": 4,
    "num_warps": 4
  },
  "2": {
    "BLOCK_SIZE_K": 128,
    "BLOCK_SIZE_M": 16,
    "BLOCK_SIZE_N": 64,
    "GROUP_SIZE_M": 32,
    "NEED_TRANS": false,
    "USE_TMA": false,
    "WARP_SPECIALIZE": false,
    "num_stages": 5,
    "num_warps": 4
  },
  "2048": {
    "BLOCK_SIZE_K": 128,
    "BLOCK_SIZE_M": 64,
    "BLOCK_SIZE_N": 128,
    "GROUP_SIZE_M": 16,
    "NEED_TRANS": false,
    "USE_TMA": false,
    "WARP_SPECIALIZE": false,
    "num_stages": 3,
    "num_warps": 8
  },
  "24": {
    "BLOCK_SIZE_K": 128,
    "BLOCK_SIZE_M": 32,
    "BLOCK_SIZE_N": 32,
    "GROUP_SIZE_M": 32,
    "NEED_TRANS": false,
    "USE_TMA": false,
    "WARP_SPECIALIZE": false,
    "num_stages": 2,
    "num_warps": 4
  },
  "256": {
    "BLOCK_SIZE_K": 128,
    "BLOCK_SIZE_M": 16,
    "BLOCK_SIZE_N": 64,
    "GROUP_SIZE_M": 16,
    "NEED_TRANS": true,
    "USE_TMA": false,
    "WARP_SPECIALIZE": false,
    "num_stages": 5,
    "num_warps": 4
  },
  "3072": {
    "BLOCK_SIZE_K": 128,
    "BLOCK_SIZE_M": 64,
    "BLOCK_SIZE_N": 128,
    "GROUP_SIZE_M": 16,
    "NEED_TRANS": false,
    "USE_TMA": false,
    "WARP_SPECIALIZE": false,
    "num_stages": 3,
    "num_warps": 8
  },
  "32": {
    "BLOCK_SIZE_K": 128,
    "BLOCK_SIZE_M": 16,
    "BLOCK_SIZE_N": 64,
    "GROUP_SIZE_M": 64,
    "NEED_TRANS": true,
    "USE_TMA": false,
    "WARP_SPECIALIZE": false,
    "num_stages": 4,
    "num_warps": 4
  },
  "4": {
    "BLOCK_SIZE_K": 64,
    "BLOCK_SIZE_M": 16,
    "BLOCK_SIZE_N": 32,
    "GROUP_SIZE_M": 1,
    "NEED_TRANS": false,
    "USE_TMA": false,
    "WARP_SPECIALIZE": false,
    "num_stages": 5,
    "num_warps": 4
  },
  "4096": {
    "BLOCK_SIZE_K": 128,
    "BLOCK_SIZE_M": 64,
    "BLOCK_SIZE_N": 128,
    "GROUP_SIZE_M": 16,
    "NEED_TRANS": false,
    "USE_TMA": false,
    "WARP_SPECIALIZE": false,
    "num_stages": 3,
    "num_warps": 8
  },
  "48": {
    "BLOCK_SIZE_K": 128,
    "BLOCK_SIZE_M": 32,
    "BLOCK_SIZE_N": 32,
    "GROUP_SIZE_M": 64,
    "NEED_TRANS": false,
    "USE_TMA": false,
    "WARP_SPECIALIZE": false,
    "num_stages": 3,
    "num_warps": 4
  },
  "512": {
    "BLOCK_SIZE_K": 128,
    "BLOCK_SIZE_M": 16,
    "BLOCK_SIZE_N": 64,
    "GROUP_SIZE_M": 1,
    "NEED_TRANS": true,
    "USE_TMA": false,
    "WARP_SPECIALIZE": false,
    "num_stages": 3,
    "num_warps": 4
  },
  "64": {
    "BLOCK_SIZE_K": 128,
    "BLOCK_SIZE_M": 16,
    "BLOCK_SIZE_N": 32,
    "GROUP_SIZE_M": 16,
    "NEED_TRANS": true,
    "USE_TMA": false,
    "WARP_SPECIALIZE": false,
    "num_stages": 4,
    "num_warps": 4
  },
  "8": {
    "BLOCK_SIZE_K": 128,
    "BLOCK_SIZE_M": 16,
    "BLOCK_SIZE_N": 128,
    "GROUP_SIZE_M": 1,
    "NEED_TRANS": false,
    "USE_TMA": true,
    "WARP_SPECIALIZE": false,
    "num_stages": 3,
    "num_warps": 4
  },
  "96": {
    "BLOCK_SIZE_K": 128,
    "BLOCK_SIZE_M": 16,
    "BLOCK_SIZE_N": 64,
    "GROUP_SIZE_M": 32,
    "NEED_TRANS": false,
    "USE_TMA": false,
    "WARP_SPECIALIZE": false,
    "num_stages": 3,
    "num_warps": 4
  }
}