lightllm/common/triton_utils/autotune_kernel_configs/triton_3.5.1/NVIDIA_H200/moe_align_fused:v1/{topk_num=8}_NVIDIA_H200.json
{
  "1": {
    "BLOCK_SIZE": 256,
    "num_warps": 4
  },
  "100": {
    "BLOCK_SIZE": 128,
    "num_warps": 8
  },
  "1024": {
    "BLOCK_SIZE": 256,
    "num_warps": 4
  },
  "128": {
    "BLOCK_SIZE": 256,
    "num_warps": 8
  },
  "16": {
    "BLOCK_SIZE": 128,
    "num_warps": 8
  },
  "256": {
    "BLOCK_SIZE": 128,
    "num_warps": 8
  },
  "32": {
    "BLOCK_SIZE": 128,
    "num_warps": 8
  },
  "64": {
    "BLOCK_SIZE": 128,
    "num_warps": 8
  },
  "8": {
    "BLOCK_SIZE": 128,
    "num_warps": 8
  }
}