lightllm/common/triton_utils/autotune_kernel_configs/triton_3.6.0/NVIDIA_H100_80GB_HBM3/grouped_matmul:v1/{K=256,N=4096,expert_num=256,mul_routed_weight=true,out_dtype=torch.bfloat16,topk_num=1,use_fp8_w8a8=true}_NVIDIA_H100_80GB_HBM3.json
{
  "12288": {
    "BLOCK_SIZE_K": 128,
    "BLOCK_SIZE_M": 64,
    "BLOCK_SIZE_N": 128,
    "GROUP_SIZE_M": 64,
    "NEED_TRANS": false,
    "num_stages": 3,
    "num_warps": 4
  },
  "1536": {
    "BLOCK_SIZE_K": 64,
    "BLOCK_SIZE_M": 16,
    "BLOCK_SIZE_N": 128,
    "GROUP_SIZE_M": 1,
    "NEED_TRANS": true,
    "num_stages": 3,
    "num_warps": 4
  },
  "192": {
    "BLOCK_SIZE_K": 128,
    "BLOCK_SIZE_M": 16,
    "BLOCK_SIZE_N": 128,
    "GROUP_SIZE_M": 16,
    "NEED_TRANS": true,
    "num_stages": 2,
    "num_warps": 4
  },
  "24576": {
    "BLOCK_SIZE_K": 128,
    "BLOCK_SIZE_M": 64,
    "BLOCK_SIZE_N": 128,
    "GROUP_SIZE_M": 32,
    "NEED_TRANS": false,
    "num_stages": 3,
    "num_warps": 4
  },
  "384": {
    "BLOCK_SIZE_K": 128,
    "BLOCK_SIZE_M": 16,
    "BLOCK_SIZE_N": 128,
    "GROUP_SIZE_M": 16,
    "NEED_TRANS": true,
    "num_stages": 2,
    "num_warps": 4
  },
  "48": {
    "BLOCK_SIZE_K": 64,
    "BLOCK_SIZE_M": 16,
    "BLOCK_SIZE_N": 128,
    "GROUP_SIZE_M": 64,
    "NEED_TRANS": true,
    "num_stages": 3,
    "num_warps": 4
  },
  "49152": {
    "BLOCK_SIZE_K": 128,
    "BLOCK_SIZE_M": 64,
    "BLOCK_SIZE_N": 128,
    "GROUP_SIZE_M": 16,
    "NEED_TRANS": false,
    "num_stages": 3,
    "num_warps": 4
  },
  "6": {
    "BLOCK_SIZE_K": 64,
    "BLOCK_SIZE_M": 16,
    "BLOCK_SIZE_N": 128,
    "GROUP_SIZE_M": 32,
    "NEED_TRANS": true,
    "num_stages": 2,
    "num_warps": 4
  },
  "600": {
    "BLOCK_SIZE_K": 128,
    "BLOCK_SIZE_M": 16,
    "BLOCK_SIZE_N": 128,
    "GROUP_SIZE_M": 16,
    "NEED_TRANS": true,
    "num_stages": 2,
    "num_warps": 4
  },
  "6144": {
    "BLOCK_SIZE_K": 128,
    "BLOCK_SIZE_M": 64,
    "BLOCK_SIZE_N": 128,
    "GROUP_SIZE_M": 64,
    "NEED_TRANS": false,
    "num_stages": 3,
    "num_warps": 4
  },
  "768": {
    "BLOCK_SIZE_K": 128,
    "BLOCK_SIZE_M": 16,
    "BLOCK_SIZE_N": 128,
    "GROUP_SIZE_M": 16,
    "NEED_TRANS": true,
    "num_stages": 2,
    "num_warps": 4
  },
  "96": {
    "BLOCK_SIZE_K": 128,
    "BLOCK_SIZE_M": 16,
    "BLOCK_SIZE_N": 128,
    "GROUP_SIZE_M": 64,
    "NEED_TRANS": true,
    "num_stages": 2,
    "num_warps": 4
  }
}