lightllm/common/triton_utils/autotune_kernel_configs/triton_3.5.1/NVIDIA_GeForce_RTX_5090/gated_rmsnorm_forward:v1/{N=128,has_bias=false,weight_dtype=torch.bfloat16,x_dtype=torch.bfloat16}_NVIDIA_GeForce_RTX_5090.json
{
  "1024": {
    "BLOCK_N": 1024,
    "num_warps": 1
  },
  "128": {
    "BLOCK_N": 1024,
    "num_warps": 2
  },
  "131072": {
    "BLOCK_N": 128,
    "num_warps": 2
  },
  "16384": {
    "BLOCK_N": 128,
    "num_warps": 1
  },
  "2048": {
    "BLOCK_N": 128,
    "num_warps": 1
  },
  "256": {
    "BLOCK_N": 256,
    "num_warps": 8
  },
  "32768": {
    "BLOCK_N": 128,
    "num_warps": 1
  },
  "512": {
    "BLOCK_N": 128,
    "num_warps": 1
  },
  "64": {
    "BLOCK_N": 128,
    "num_warps": 2
  },
  "8": {
    "BLOCK_N": 64,
    "num_warps": 2
  },
  "800": {
    "BLOCK_N": 128,
    "num_warps": 1
  },
  "8192": {
    "BLOCK_N": 128,
    "num_warps": 2
  }
}