lightllm/common/all_kernel_configs/moe_silu_and_mul_kernel/{N=128,out_dtype=torch.bfloat16}_NVIDIA_A800-SXM4-80GB.json
{"1": {"BLOCK_M": 2, "BLOCK_N": 512, "num_warps": 8}, "8": {"BLOCK_M": 16, "BLOCK_N": 64, "num_warps": 16}, "64": {"BLOCK_M": 8, "BLOCK_N": 64, "num_warps": 8}, "128": {"BLOCK_M": 8, "BLOCK_N": 64, "num_warps": 4}, "256": {"BLOCK_M": 4, "BLOCK_N": 128, "num_warps": 16}, "512": {"BLOCK_M": 8, "BLOCK_N": 64, "num_warps": 4}, "1024": {"BLOCK_M": 16, "BLOCK_N": 64, "num_warps": 8}, "2048": {"BLOCK_M": 16, "BLOCK_N": 64, "num_warps": 4}, "4096": {"BLOCK_M": 4, "BLOCK_N": 128, "num_warps": 4}, "8192": {"BLOCK_M": 8, "BLOCK_N": 128, "num_warps": 4}}