lightllm/common/all_kernel_configs/moe_silu_and_mul_kernel/{N=2048,out_dtype=torch.bfloat16}_NVIDIA_H800.json
{"1": {"BLOCK_M": 1, "BLOCK_N": 512, "num_warps": 8}, "8": {"BLOCK_M": 1, "BLOCK_N": 256, "num_warps": 4}, "64": {"BLOCK_M": 1, "BLOCK_N": 1024, "num_warps": 8}, "128": {"BLOCK_M": 1, "BLOCK_N": 512, "num_warps": 8}, "256": {"BLOCK_M": 1, "BLOCK_N": 512, "num_warps": 4}, "512": {"BLOCK_M": 1, "BLOCK_N": 1024, "num_warps": 8}, "1024": {"BLOCK_M": 1, "BLOCK_N": 1024, "num_warps": 2}, "2048": {"BLOCK_M": 1, "BLOCK_N": 1024, "num_warps": 2}, "4096": {"BLOCK_M": 1, "BLOCK_N": 1024, "num_warps": 8}, "8192": {"BLOCK_M": 1, "BLOCK_N": 1024, "num_warps": 8}}