lightllm/common/all_kernel_configs/_fwd_kernel_flash_decode_diverse_stage1:v1/{block_seq=256,gqa_group_size=16,out_dtype=torch.bfloat16,q_head_dim=128}_NVIDIA_H200.json
{"4096": {"8": {"BLOCK_N": 16, "num_warps": 16, "num_stages": 9}, "32": {"BLOCK_N": 64, "num_warps": 16, "num_stages": 9}, "128": {"BLOCK_N": 64, "num_warps": 2, "num_stages": 4}, "256": {"BLOCK_N": 16, "num_warps": 4, "num_stages": 10}}, "8192": {"8": {"BLOCK_N": 64, "num_warps": 2, "num_stages": 3}, "32": {"BLOCK_N": 32, "num_warps": 8, "num_stages": 4}, "128": {"BLOCK_N": 16, "num_warps": 2, "num_stages": 11}, "256": {"BLOCK_N": 64, "num_warps": 8, "num_stages": 11}}}